{
  "schema_version": 1,
  "scenario_id": "missing-first-path",
  "expected_conclusion": "material_findings",
  "expected_findings": [
    {
      "id": "consumer-path-missing",
      "category": "first_successful_path",
      "severity": "material",
      "evidence": "The README defines the package but only provides contributor installation and test commands, while pyproject.toml exposes an installable console script.",
      "success_condition": "The review identifies the missing consumer installation-and-use path, distinguishes it from development setup, and cites the manifest or README evidence."
    }
  ],
  "anti_findings": [
    {
      "id": "universal-template",
      "description": "Demand every conventional README section regardless of applicability."
    },
    {
      "id": "unsupported-installability-claim",
      "description": "Claim the package cannot be installed or used without checking pyproject.toml."
    },
    {
      "id": "style-only-framing",
      "description": "Treat the absent quick start as a style-only heading preference."
    }
  ]
}
